tweet,label,,,,,,,,,,,,,,,,,,,,,,,,,,
yiğitler burcu bölgemizdeyiz. aradaki tel örgü kuzey kıbrıs türk cumhuriyeti ile güney kıbrıs rum yönetimi'ni birbirinden ayırıyor. tarihini bilmeyenin değeri olmaz... #csuoryantasyon2019 #welcometoorange19,hiçbiri,,,,,,,,,,,,,,,,,,,,,,,,,,
cumhurbaşkanı erdoğan "kıbrıs meselesi 50 yıldan uzun süredir devam eden müzakerelere rağmen rum tarafının tavrı yüzünden çözüme kavuşamamıştır.",hiçbiri,,,,,,,,,,,,,,,,,,,,,,,,,,
yunan'a eskiden rum denirmiş mustafa kemal bunları izmir'de denize döktükten sonra yunan olmuş yani yıkanmak temizlenmekteki yunmak. 100 giderli etimolojik mizahtır kshsaja,nefret,,,,,,,,,,,,,,,,,,,,,,,,,,
sayısız kez yazdım tekrar edeyim. benim ermeni rum yahudi hristiyan hiçbir vatandaşımızla sorunum yoktur. bunu yaparsam gayrimüslim arkadaşlarıma ihanet etmiş olurum. kimliğini inkar eden taşnak siyon pontus ve pakradunilerdir bu ülkede sorun çıkarıp bekamızı tehdit edenler,nefret,,,,,,,,,,,,,,,,,,,,,,,,,,
kktc cumhuriyet meclisi başkan yardımcısı töre "rum zihniyetiyle siyasi eşitlik düzeyinde bir anlaşmaya varmamız mümkün değil" haberin devamı için tıklayın...,nefret,,,,,,,,,,,,,,,,,,,,,,,,,,
reis bm genel kurulunda suudi'lere israil'e rumlara ermenilere keşmir sorunu'na pkk ve ypg'ye kötü daldı be yaa...,nefret,,,,,,,,,,,,,,,,,,,,,,,,,,
tebrikler sayın başkan bm konuşmanızda sandalyelerini popoları ile sağa sola çekmeye çalışarak şirin gözükmeye çalışan katil siyonist israil ve uşağı suudiler ve de ermeni ve rum'ları gömmenizden dolayı,nefret,,,,,,,,,,,,,,,,,,,,,,,,,,
erdoğan kıbrıs meselesi rum tarafının uzlaşmaz tavrı nedeniyle çözülemedi. türkiye'kıbrıs ta garantördür yunanistan garantördür ingiltere garantördür,hiçbiri,,,,,,,,,,,,,,,,,,,,,,,,,,
cumhurbaşkanımız bm genel kurulunda yargı dağıtıyor... kırbacı çıkarmış bir israil'e koyuyor bir abd'ye bir mısır'a bir kıbrıs rum kesimine. #ourvoiceerdogan,hiçbiri,,,,,,,,,,,,,,,,,,,,,,,,,,
cb erdoğan bmgk'da konuşuyor kıbrıs rum tarafının uzlaşmaz tavrı nedeniyle 50 yıldır çözüme kavuşamadı. doğu akdeniz'deki enerji kaynakları konusunda hem türkiye'nin hem de kıbrıs halkının haklarını sonuna kadar koruyacağız. kaşıkçı cinayeti konusunu da takip edeceğiz,hiçbiri,,,,,,,,,,,,,,,,,,,,,,,,,,
cumhurbaşkanı recep tayyip erdoğan "kıbrıs meselesi çözüme kavuşamamıştır. rum tarafı adaletsiz bir siyaset izliyor" dedi.,hiçbiri,,,,,,,,,,,,,,,,,,,,,,,,,,
kıbrıs sorunun 50 yıldan beridir çözülememesinin sebebinin rum tarafının tutumu olduğunu söyledi. doğu akdeniz'deki doğalgaz aramasının kazan kazan şeklinde bir metodu söyledi. haklarımızı sonuna kadar savunacağız dedi.,hiçbiri,,,,,,,,,,,,,,,,,,,,,,,,,,
erdoğan'ın şu ana kadar konuşmasının ana ekseni doğal olarak göç ve suriyeliler meselesi. hah geldik doğu akdeniz meselesine... kıbrıs meselesini çözmemiz gerektiğini söylüyor. rum tarafına da çakıyor doğal olarak.,hiçbiri,,,,,,,,,,,,,,,,,,,,,,,,,,
dünyada 2 tane ermeni 3 tane rum 5 tane yahudi 10 tane hristiyan ölse birleşmiş milletler hemen ayağa kalkardı... yıllardır her gün müslüman ölüyor ama kimsenin umrunda değil...,hiçbiri,,,,,,,,,,,,,,,,,,,,,,,,,,
gkry lideri "kıbrıs yunandır" temalı konuşmasını eleştiren kktc cumhurbaşkanı akıncı rum basını tarafından açık hedef haline getirildi. ada'da türklerin eşitliğinin mümkün olamayacağı görüşünü savunan rum basını "küçük bir azınlık şeklinde kalacağı" sanrısını inatla sürdürdü.,hiçbiri,,,,,,,,,,,,,,,,,,,,,,,,,,
dışişleri bakanımız sn. rum dışişleri bakanına bm binasında haddini bildirirken,hiçbiri,,,,,,,,,,,,,,,,,,,,,,,,,,
siz ancak tinerci dersiniz 2 yıllık tarihi olan takım dersiniz biz ise size şikeci deriz fetöcü deriz rum deriz fransız deriz maklubeci deriz gavur tohumu deriz sizin efsaneniz fethullah gülen adlı kansız ve zekeriya öz denen piç kurusu bizim efsanemiz seba ve baba hakkı'dır,nefret,,,,,,,,,,,,,,,,,,,,,,,,,,
koskoca 2 yıllık tarihimiz olduğunu söyleyen rum ve fransız tohumları sizin gibi şikeli şaibeli geçmişimiz yok en azından son 10 yılda en çok ülke puanı getiren takımız haram kupası olmayan takımız,nefret,,,,,,,,,,,,,,,,,,,,,,,,,,
çavuşoğlu'dan rum bakana anında cevap,hiçbiri,,,,,,,,,,,,,,,,,,,,,,,,,,
rum lider anastasiadis türkiye'nin garantörlüğü kalksın adadan tsk askerleri çıksın türkiye doğu akdeniz'den çekilsin ön şartlarımız bunlar kabul ederseniz müzakerelere başlayabiliriz diyor. eşitlik olmaz buna da karşı... #anlayana #kktc hala federasyonda ısrarcısıyız...,hiçbiri,,,,,,,,,,,,,,,,,,,,,,,,,,
yani benim anlatmak istediğim türk'ün kürdün rum'un çerkes'in bulgar'ın vs geçmişini bu kadar kolay satması. müslüman olabilirsin ama atadan dededen müslüman gibi dolaşman anlatabildim mi sana bunun için neden hürmet edeyim davar insan sen de bir insansın sonuçta,hiçbiri,,,,,,,,,,,,,,,,,,,,,,,,,,
rum bakan bm'de hadsizlik yapınca çavuşoğlu ayarı verdi!,hiçbiri,,,,,,,,,,,,,,,,,,,,,,,,,,
asıl abdestsiz olan önüne gelen karıyı kılıç zoruyla hareme tıkıp don paça saray dehlizlerinde kadın peşinde koşan osmanlı hanedanı ermeni yahudi rum pontus kadınlardan doğan ecdadım dediğin osmanlı'nın ta kendisidir,hiçbiri,,,,,,,,,,,,,,,,,,,,,,,,,,
çavuşoğlu ve rum bakan arasında kıbrıs'ta federasyon tartışması,hiçbiri,,,,,,,,,,,,,,,,,,,,,,,,,,
mithat sancar başkanlığındaki heyetimiz kayyım darbesi demokratik anayasa demokrasi ittifakı yargı paketi konularında abf pir sultan abdal kültür derneği ve hacı bektaş veli anadolu kültür vakfını ziyaret etti. alevi halkının talepleri taleplerimizdir.,hiçbiri,,,,,,,,,,,,,,,,,,,,,,,,,,
meclis başkan vekilimiz mithat sancar başkanlığındaki heyetimiz kayyım darbesi başta olmak üzere yargı paketi demokrasi ittifakı ve demokratik anayasa görüşmelerimiz kapsamında alevi bektaşi federasyonu ve pir sultan abdal kültür derneği temsilcileri ile bir araya geldi.,hiçbiri,,,,,,,,,,,,,,,,,,,,,,,,,,
örnek önüme düştü. bakın eski bir alevi subayımız ömer adına kinini kusmuş. ayrımcılık budur,nefret,,,,,,,,,,,,,,,,,,,,,,,,,,
tüm binamız sokağımız ve mahallemiz alevi ama aşure yok. inanabiliyor musunuz ya? birazdan alt komşu hatice teyzeyi ve diğer mahalle sakinlerimizi derhal aşure yapmaları konusunda uyaracağım.,hiçbiri,,,,,,,,,,,,,,,,,,,,,,,,,,
sünni kardeşlerimizin kadir gecesi'nde orucunu tutuyorum alevi kardeşlerimizin 10. gününde oruç tutuyorum. kimse kırılmasın hak geçmesin. yalnız bu oruç baya zormuş su et falan yok,hiçbiri,,,,,,,,,,,,,,,,,,,,,,,,,,
alevi aşura töreni alevi ashura ceremony,hiçbiri,,,,,,,,,,,,,,,,,,,,,,,,,,
ateşte de olay pire mi deve mi onu seçemiyorum saman alevi sönene kadar dkskkddkdjdks,hiçbiri,,,,,,,,,,,,,,,,,,,,,,,,,,
bu akşam binlerce cemevinde sevgili peygamberimizin torunu hz. hüseyin ve yanındakilerin kerbela'da şehit edilmelerinden dolayı matem törenleri düzenleniyor. milyonlarca alevi ile birlikte ben de bir sünni ailenin evladı olarak okunan ağıtlara katılacağım.,hiçbiri,,,,,,,,,,,,,,,,,,,,,,,,,,
hani bir alevi türküsü vardır... ağlama gönül ağlama sen ali'den yüce misin? diye. türk yargısının sahte delillerle kumpas kurulmuştur dediği yerde siz türk yargısından daha mı yücesiniz ki bu fetö kumpasını meşru görüyorsunuz?,hiçbiri,,,,,,,,,,,,,,,,,,,,,,,,,,
saman alevi sinirim online cızz,hiçbiri,,,,,,,,,,,,,,,,,,,,,,,,,,
şah hüseyn-i kerbela'nın baş açık abdalıyam kıblegahımdır muhammed secdegahımdır ali. şah hatayı #alevi #türküler #alevicanlar #deyişler,hiçbiri,,,,,,,,,,,,,,,,,,,,,,,,,,
bu sene aşure getiren de olmadı alevi komşularımız da yapmamış candan seslendim yok bu sene yapmadım niye gıı dedim işten geliyorum yorgunum dedi #asure #pazartesi,hiçbiri,,,,,,,,,,,,,,,,,,,,,,,,,,
meclis başkan vekilimiz mithat sancar başkanlığındaki heyetimiz kayyım darbesi başta olmak üzere yargı paketi demokrasi ittifakı ve demokratik anayasa görüşmelerimiz kapsamında alevi bektaşi federasyonu ve pir sultan abdal kültür derneği temsilcileri ile bir araya geldi.,hiçbiri,,,,,,,,,,,,,,,,,,,,,,,,,,
taha akyol'un şu kitabı baya iyidir. celali ve alevi isyanların salt mezhebi değil türkmenin yörüğün geçim derdi olduğunu anlatır. vergi meselesi sıkıntılı mevzu,hiçbiri,,,,,,,,,,,,,,,,,,,,,,,,,,
bugün muharrem ayı ve kerbela bütün alevi müslüman arkadaşlarıma acılarımız aynıdır,hiçbiri,,,,,,,,,,,,,,,,,,,,,,,,,,
temelli bir tek tanrı inancıydı bu. bu anlayış islam'dan sonra bile alttan alta sürdü geldi. alevi denilen kitle bu inancı bugünlere kadar islam ile harmanlayarak taşıdı. islam'dan çok eskidir türkler tanrı kavramına bütün milletlerden önce ulaşmışlardır.,hiçbiri,,,,,,,,,,,,,,,,,,,,,,,,,,
burada alevi kavramını toplumsal bir aidiyetten ziyade fikri ve hissi bir aidiyet anlamında daha geniş kapsamda kullanıyorum. bu fikri ve hissi paylaşan herkese açıktır.,hiçbiri,,,,,,,,,,,,,,,,,,,,,,,,,,
hz. muhammed'den kerbela'ya kerbela'dan günümüze hak muhammet ali diyen alevi canlarımızla devletimizin devletimizle de alevi canların kucaklaşma zamanı. gelin canlar bir olalım. büyük türkiye olalım. usesam yönetim kurulu başkanı avukat psikolog sosyolog alevi dedesi müseyip erdoğmuş,hiçbiri,,,,,,,,,,,,,,,,,,,,,,,,,,
kor bir alevi tutar iki elim hak mı bu bana?,hiçbiri,,,,,,,,,,,,,,,,,,,,,,,,,,
en yakın arkadaşlarımdan biri kürttü biri alevi hala severim hala isimlerini anarım semboller geçici sevelim birbirimizi ya bu kadar mı zor ben anlamıyorum! hayır illa böyle bayram şekeri gibi konuşmak zorunda mıyım! bak yine atarlandım,hiçbiri,,,,,,,,,,,,,,,,,,,,,,,,,,
alevi ve sünni çekişmesi ilk hazreti ali efendimizin şehit edilmesinden sonra büyük ivme kazanmıştır. esas çekişme peygamberin vefatı sonrası imamet konusunda çıktı abdullah bin sebe yahudisi konusu sünnilerin götünden element uydurma hadisesidir.,nefret,,,,,,,,,,,,,,,,,,,,,,,,,,
genel olarak bu gibi müdahaleler enflasyonun artmasına yol açar artan fiyatlar yine tüketicinin cebinden ödenir. para arzını arttırarak sağlanan ekonomik canlanma uzun sürmez ve saman alevi gibi parlayıp geçer.,hiçbiri,,,,,,,,,,,,,,,,,,,,,,,,,,
mecliste siyaset yapmanın anlamı yok. çekilin şu parlamentodan. kürt halkı sizin dönekliğiniz yüzünden direnişçiliğini kaybediyor. chp'nin kuyruğuna takılmaktan vazgeçin. yüzünüzü burjuvaziye değil ezilen halklara dönün.,saldırgan,,,,,,,,,,,,,,,,,,,,,,,,,,
hz ali çok havalı alevi olsaydım keşke. hz muhammed'in bir fotosu bile yok çok çirkindi herhalde,nefret,,,,,,,,,,,,,,,,,,,,,,,,,,
o kadar fabrika yandı bu sefer sadece 2 taneyi üstlenmişler. biz de inandık... paravan ateşin çocukları yakıyor hbdh de işine geleni üstleniyor işine gelmeyeni üstlenmiyor.,hiçbiri,,,,,,,,,,,,,,,,,,,,,,,,,,
akp genel başkanı erdoğan malatya'da canlı yayında "kardeşlerim sünni alevi ayrımı var mı? biz hiçbir zaman böyle bir ayrım yapmadık" bakalım 2014 cumhurbaşkanlığı seçimi mitinginde ne demiş?,hiçbiri,,,,,,,,,,,,,,,,,,,,,,,,,,
#ahmetyenilmez sizin şu bulunduğunuz resim yüzyıl öncesinin intikamını almaya gelmiş olanlara verilmiş türkün kürdün lazın çerkezin alevinin sünninin analarının duruşu. ben onun için geldim buraya...,hiçbiri,,,,,,,,,,,,,,,,,,,,,,,,,,
kardeş türküler bugün güzellerin sah-i gördüm tanıdığım en alevi bireye gelsin... :),hiçbiri,,,,,,,,,,,,,,,,,,,,,,,,,,
alevi mi? alevrimi mi? saz çalmakla alevi olunmaz...,hiçbiri,,,,,,,,,,,,,,,,,,,,,,,,,,
kılıçdaroğlu'nun kendisi alevi siyasi partinin başında neyi eksik? diyen kimdi ?,hiçbiri,,,,,,,,,,,,,,,,,,,,,,,,,,
sy jb siz alevi ile bir olamazsınız aleviler eline beline diline hakim olan kişilerdir,hiçbiri,,,,,,,,,,,,,,,,,,,,,,,,,,
ya biz süryaniyiz ya onlar alevi!,hiçbiri,,,,,,,,,,,,,,,,,,,,,,,,,,
denize atılan izmariti konu ederken lgbti alevi ve kürt'ü veya en azından genel çerçevesiyle "ayrımcılığı" konu etmemeleri de bir tercihtir ve bu da politiktir. bu tercihlerinden dolayı da eleştirilmeyi göze almış olmaları gerekir.,hiçbiri,,,,,,,,,,,,,,,,,,,,,,,,,,
çalıştığım yerde malatya'nın köyünden misin merkezinden mi diye soruyorlar bu şey demek alevi misin sünni misin,hiçbiri,,,,,,,,,,,,,,,,,,,,,,,,,,
bazen su olmak lazım sessiz sakin! bazen sel olmak lazım öfkeli ve hırçın! bazen mum alevi sabırla tükenmeyi bekleyen! bazense volkan önüne gelen her şeyi hızla tüketen! kimine su olacaksın kimine sel! kimine mum olacaksın kimine volkan! ama kimseye asla "kul" olmayacaksın!,hiçbiri,,,,,,,,,,,,,,,,,,,,,,,,,,
disa barış okulu 7 eylül cumartesi günü cuma çiçek ve vivet alevi'nin seminerleriyle başladı. ilk gün toplumsal barışın inşasında sivil toplumun rolüne dair teorik bir çerçeve çizildi ve grup içi sosyalleşmede şiddetsiz iletişimin önemi konuşuldu.,hiçbiri,,,,,,,,,,,,,,,,,,,,,,,,,,
avşar alevi türkmenlerinin anadolu ve suriye geçmişi büyük sahabe hazreti ali ra bin ebu talib'e ve hatta peygamber muhammed mustafa sav efendimizin hendek muharebesine dek dayanır. hz muhammed aleyhisselam hendek muharebesinde ilk kez bir türk ailesiyle haşir neşir olur.,hiçbiri,,,,,,,,,,,,,,,,,,,,,,,,,,
#muharrem önceden güneşe göre oruç açılırdı sahur falan olmaz yeme içme sınırlı idi iftar diye bir kelime geçmezdi iyice sünni dine uydular alevi kızılbaşlar yakında top da patlatılır kiminle gezersen ona benzersiniz,nefret,,,,,,,,,,,,,,,,,,,,,,,,,,
sözde alevi arkadaşlarım her zaman gösterdiğiniz duyarın üçte birini tutulan oruçlara da saygı duyup tükettiğiniz alkollü içeceklerin fotoğraflarını paylaşmazsanız mı :),nefret,,,,,,,,,,,,,,,,,,,,,,,,,,
1 canan kaftancıoğlu bir şeyler demiş diye hainlik ediyor yanlış yapıyor yok öyle şey la diye kızıyorlar. la olum ben türk ve alevi kökenliyim atalarım yakın zaman büyüklerim ve ben sizlerin insanlarıma ve bana neler yapıldığını biliyorsunuz.,hiçbiri,,,,,,,,,,,,,,,,,,,,,,,,,,
ailevi sorunları her defasında alevi sorunları diye okumam,hiçbiri,,,,,,,,,,,,,,,,,,,,,,,,,,
dara çekmek bir alevi ritüelidir. kişiyi eleştirmek cezasını belirlemek için yapılır. dar ağacı da buradan gelir. ankara'yı dar etmek. ankara'yı dara çekmek isteyenlere duyurulur. yavaş gelin biraz,hiçbiri,,,,,,,,,,,,,,,,,,,,,,,,,,
bu kapılara sınırlara durduk yere bakılmaz ilk casusluk davasında ki alevi kimlikler üzerine yazılımlar ile baktım çünkü türk kadını konu askeri polisi olduğunda seks işçisi de olsa bu denli rahat ifadeler vermez sonra ermeni soykırım dosyası ve canlı bombalar nedeniyle baktım,hiçbiri,,,,,,,,,,,,,,,,,,,,,,,,,,
mum alevi kadar titrek bir umuda sarılarak sabahı zor ettiğim geceden sonra senin için hiçbir şey oluşum gerçeğini cebime koydum ayaz bir eylül sabahında evime döndüm...,hiçbiri,,,,,,,,,,,,,,,,,,,,,,,,,,
kimsenin ne siyasi ne dini görüşüne saygısızlık yapmadım düşüncelerimi söyledim ideolojimi belli ettim . ailemden aldığım terbiye buna hiç izin vermedi. ramazan'da içki içilmez deyip alevi vatandaşların tuttuğu oruçlarda kadeh kaldıranlara aleviler de dahil,hiçbiri,,,,,,,,,,,,,,,,,,,,,,,,,,
hayatın tadını en çok yıkılırken alıyorum. alev alevi ancak güçlendirir. kalbimde kal.,hiçbiri,,,,,,,,,,,,,,,,,,,,,,,,,,
rejimin böyle bir iç operasyona gideceğini zannedenler vardı. rejim öyle yönetmez. bunlar egemenler arası paylaşım itişmeleridir. devlet terörünün hedefi sadece 3 tarihsel hareket ve onların ittifak zeminleridir işçi alevi ve kürt hareketi. bunların "locus"u da bugün hdp dir.,hiçbiri,,,,,,,,,,,,,,,,,,,,,,,,,,
ileri kitap şilan geçgel yazdı devletin sakıncalılar listesinde alevi kürtler,hiçbiri,,,,,,,,,,,,,,,,,,,,,,,,,,
alevi kültür derneklerinde kayyum tartışması!,hiçbiri,,,,,,,,,,,,,,,,,,,,,,,,,,
#susamam sosyal medyada saman alevi.,hiçbiri,,,,,,,,,,,,,,,,,,,,,,,,,,
dağıstanlı müslüman dövüşçü #habib amerikalı #dustinpoirer'i yendiği maç sonrası tüm dünyaya sportmenlik dersi verdi.,hiçbiri,,,,,,,,,,,,,,,,,,,,,,,,,,
halide edip'i okumamış laik ömer seyfettin'i okumamış milliyetçi ve mehmet akif'i tanımayan müslüman gençlerimizin buluştuğu müzik bu. bu adam müzisyen. allah bilir nota okumasını bilmez. sultaniyegah ile mahur'u ayırt edemez. ama gençlerin "idolü" bu... allah affetsin bizi.,hiçbiri,,,,,,,,,,,,,,,,,,,,,,,,,,
%85 ateist olan isveç yolsuzlukta dünya sonuncusu... %99'u müslüman olan türkiye yolsuzlukta dünya ikincisi!...,nefret,,,,,,,,,,,,,,,,,,,,,,,,,,
her müslüman için lazım gelen şey allah ehl-i beyt'ten her türlü kötülüğü gidermek ve onları tertemiz yapmak ister ayetinde allah teala'yı tasdik ederek ehl-i beyt'ten sadır olan her şeyi allah teala'nın affettiğine inanmaktır. allah teala'nın kendilerinin temiz olduğuna ve,hiçbiri,,,,,,,,,,,,,,,,,,,,,,,,,,
arapların türkiye sevgisi maaz ibrahimoğlu "türkiye'nin müslüman ve modern hayata verdiği toleransın yüksek olduğunu ifade eden dinari bu nedenle istanbul'u tercih ettiğini belirtiyor..." ahval,hiçbiri,,,,,,,,,,,,,,,,,,,,,,,,,,
hoşgörü ve barış dini islamda bugün! pakistan'da yobaz bir meyva satıcısı müslüman bir kadının muhammed'in yasakladığını iddia ettiği kıyafetleri giyerek bisiklete binmesinin kendisini utandırdığını söylüyor! bizde senin varlığından utandık müslüman!,nefret,,,,,,,,,,,,,,,,,,,,,,,,,,
yok mu şöyle aşure getirecek müslüman bir komşu,hiçbiri,,,,,,,,,,,,,,,,,,,,,,,,,,
ey yahudi senin islamın hoşgörü getireceğine inandığın kadar inanıyorum dinine ey hristiyan senin toraya inandığın kadar inanıyorum dinine ey müslüman senin isa'nın tanrının oğlu olduğuna inandığın kadar inanıyorum dinine,hiçbiri,,,,,,,,,,,,,,,,,,,,,,,,,,
ateistin ateist olduğunu kanıtlama çabası eşcinselin eşcinsel olduğunu kanıtlama çabası müslümanın müslüman olduğunu kanıtlama çabası yobazın yobaz olduğunu kanıtlama çabası kanıtlama çabası... kanıtlama çabası... kanıtlama çabası...,hiçbiri,,,,,,,,,,,,,,,,,,,,,,,,,,
bitmiş türkiye bunu bir türk müslüman genci nasıl yapar ya?,hiçbiri,,,,,,,,,,,,,,,,,,,,,,,,,,
#döndümvededimki müslüman kardeşlerim tayyip bey'in hiç hırsızlık yolsuzluk yapmadığına kuranı kerim'e el basarak yemin edebilir misiniz?,hiçbiri,,,,,,,,,,,,,,,,,,,,,,,,,,
müslüman yürekler bilirim daha kızdı mı cehennem kesilir sevdi mi cennet eller bilirim haşin hoyrat mert alınlar görmüşüm ki vatanımın coğrafyasıdır her kırışığı sorulacak bir hesabı her çizgisi tarihten bir yaprağı anlatır. #erdembeyazıt #şehit polis müdürümüz #tufankansuva,hiçbiri,,,,,,,,,,,,,,,,,,,,,,,,,,
demek ki artık zengin müslüman kızlar okumuş diplomalı kızlar fakir dindar erkekler seçecek. hadi görelim bakalım,hiçbiri,,,,,,,,,,,,,,,,,,,,,,,,,,
bunu en çok seküler türkçü tayfa kullanıyor. en türk olma arzusundan dolayı araplıkla yaftalama kolaylığı. tabii ki bu arkadaşlar "türklük" kavramının bugün açıkça müslüman olmak ile de "arap adeti" denilen şeylerle de göbekten bağlı olduğunu inkar etmeye çalışıyor aynı zamanda,hiçbiri,,,,,,,,,,,,,,,,,,,,,,,,,,
müslüman olmayanlarla vakit geçirmek istemiyorum iğrençler demişti...,nefret,,,,,,,,,,,,,,,,,,,,,,,,,,
hangi alnı secde gören müslüman evladı acaba,hiçbiri,,,,,,,,,,,,,,,,,,,,,,,,,,
ak partili arkadaşlar tövbe etmezseniz allah'ın huzuruna müslüman katili olarak çıkacaksınız. ırak işgalinde haçlı ordusuna verdiğiniz desteği bu halk unutur ama allah unutmaz. #susamamşarkısıbana,nefret,,,,,,,,,,,,,,,,,,,,,,,,,,
bir müslümanın diktiği ağaçtan veya ektiği ekinden insan hayvan ve kuşların yedikleri şeyler o müslüman için birer sadakadır. buhari edeb 27 müslim müsakat 7 10.,hiçbiri,,,,,,,,,,,,,,,,,,,,,,,,,,
bülent arınç'ın "bir kadın olarak sus" cümlesinde ipler kopuyor. kadınlar susmak için var değildir. kadınlar iş hayatına atılınca yetersiz bir hale gelmiyor. eğitimden fizik felsefe tarih çıkarılıp din ağırlıklı dersler konulunca müslüman olunmuyor vs... dahası için anlamak gerek!,hiçbiri,,,,,,,,,,,,,,,,,,,,,,,,,,
ey müslüman sen güzellik yusuf'usun bu alem de kuyudur. seni oradan selamete çıkarıp huzura kavuşturacak ip de allah'ın emrine sabır ve teslimiyettir. mevlana,hiçbiri,,,,,,,,,,,,,,,,,,,,,,,,,,
nereden nereye 1903 yılında nobel ödülü alan fransız fizikçi pierre curie "müslüman endülüs'ten bize 30 kitap kaldı atomu parçalayabildik. şayet yakılan bir milyon kitabın yarısı kalsaydı çoktan uzayda galaksiler arasında geziyor olacaktık." demiştir.,hiçbiri,,,,,,,,,,,,,,,,,,,,,,,,,,
barış özcan... hindistan'ın aya inişini canlı yayınlıyor. öküze tapıyor dediğiniz hindistan aya ayak basarken müslüman! olan ülkemin ahlak ve saygı seviyesi yerin altında böyle geziyor.,nefret,,,,,,,,,,,,,,,,,,,,,,,,,,
siz niye susuyorsunuz? "bunlar kürt değil bunlar müslüman değil bunların din ve imanları yok amerika'ya çalışıyorlar. bunlar gavur gavur." #evlatnöbeti #annelerdireniyor #birkezolsuntepkikoyun,nefret,,,,,,,,,,,,,,,,,,,,,,,,,,
bu kitabı okumadan islam'ın psikanalizi ve islam'ın mücadelesi kimse akp'yi faslı müslüman gençlerin hayatta ilk defa gördükleri avrupalı kadınların kafasını kesmesini anlayamaz. tesettür çok ciddi bir psikolojik baskı aracıdır. tr'nin işi çok zor kitap da atatürk de var.,nefret,,,,,,,,,,,,,,,,,,,,,,,,,,
domuz eti yemez kredi çeker farz namaz kılmaz teravih kılar zina eder gusülsüz gezmez. kuranı belden aşağı indirmez kahrolsun şeriat der. memleketimden müslüman manzaraları... #şanışer,nefret,,,,,,,,,,,,,,,,,,,,,,,,,,
küffara karşı kutuplaşamayan müslüman imanını gözden geçirsin. kamalizm küffarın ta kendisidir.,nefret,,,,,,,,,,,,,,,,,,,,,,,,,,
atatürk heykelini yakan pkk'dan nefret etmediler diyanetten ettikleri kadar. oysa ki diyanet işlerini atatürk kurduğu halde... %98 müslüman olan bir ülkede #diyanetkapatılsın diyenler toplumu asimile etme çabası içerisinde olanlardır.,hiçbiri,,,,,,,,,,,,,,,,,,,,,,,,,,
ülkenin %50'si ya hırsız... ya da hırsızlığa göz yumuyor ama sorsan %90 müslüman bir ülke ve cuma'yı da hiç kaçırmazlar,nefret,,,,,,,,,,,,,,,,,,,,,,,,,,
sattıkları her şey helal kadın da erkek de müslüman ikisi de namaz kılar hamd olsun.,hiçbiri,,,,,,,,,,,,,,,,,,,,,,,,,,
diyanet şu an ruhbanlık sınıfındadır. kapatılsın demiyorum ama yapısı muhakkak değiştirilmelidir. çoğunluğu müslüman olan bir ülke için gerekli. ama ülkemde sadece müslümanlar yok. biz laik bir ülkeyiz! imamlık maaşlı diğerleri? gerçi islam'da maaşlı imam...? #diyanetkapatılsın,hiçbiri,,,,,,,,,,,,,,,,,,,,,,,,,,
birmanya'da tek günahı (!) müslüman anne babadan olmak olan çocuklara yapılan işkenceyi gördüm beş altı yaşlarındaki çocuklar bunlar. ne kadar korkunç bir varlık bu insanoğlu.,hiçbiri,,,,,,,,,,,,,,,,,,,,,,,,,,
ne diyanet müslüman mı olsun? daha neler? diyanet o israf sergisini görünce "biz neredeyiz onlar nerede fakir ibb" demiştir. diyanetin allah'tan korktuğu ile ilgili savın senin saf bir vatandaş olduğunu gösteriyor... saflığını kaybetme,hiçbiri,,,,,,,,,,,,,,,,,,,,,,,,,,
oğlu hdp tarafından dağa kaçırılan acılı anne diyarbakır'dan haykırıyor "bunlar kürt değil bunlar müslüman değil bunların din ve imanları yok amerika'ya çalışıyorlar. bunlar gavur gavur." #evlatnöbeti #annelerdireniyor #birkezolsuntepkikoyun,nefret,,,,,,,,,,,,,,,,,,,,,,,,,,
islam adına bu kadar ahlaksızlık yalan talan ve katliamlar yapılırken bir müslüman olarak ben de #susamam,hiçbiri,,,,,,,,,,,,,,,,,,,,,,,,,,
kafirler domuz yer müslümanlar yetiştirir kafirler de faiz yer müslümanlar da faiz yer kafirler de insan öldürür müslümanlar da zina eşcinsellik şiddet yolsuzluk adaletsizlik müslüman kime denir müslüman...? mesele neydi ne oldu hacı .?,nefret,,,,,,,,,,,,,,,,,,,,,,,,,,
müslüman demek allah'tan cc gelen kanunlara emir ve yasaklara teslimiyet gösteren demektir yani kuranı anayasa olarak görmeyen demokrasi müslümanların sistemi olamaz. #cumartesi,hiçbiri,,,,,,,,,,,,,,,,,,,,,,,,,,
tek müslüman yokmuş içlerinde dualar kabul olmadı al işte,hiçbiri,,,,,,,,,,,,,,,,,,,,,,,,,,
bundan sonra müslüman ünlüleri savunacağız kafirlerle araya ip katacağız,nefret,,,,,,,,,,,,,,,,,,,,,,,,,,
sabah akşam namaz kılıp dua edip ülkemizi soyan müslüman hırsızlık çetesi #türkiyeningeleceği hakkında konuşamaz,nefret,,,,,,,,,,,,,,,,,,,,,,,,,,
dünyanın en fakir 50 ülkesinin 32'si müslüman. bu 32 ülkenin devlet başkanlarının tamamı "dünyanın en zengin ilk 500 kişisi" arasında...,nefret,,,,,,,,,,,,,,,,,,,,,,,,,,
#davamızınpeşindeyiz kim tağutu inkar ederse müslüman olur,hiçbiri,,,,,,,,,,,,,,,,,,,,,,,,,,
mahşerin üç sapığı ahmet hakan'a dini sevdirmiş. ama hangi dini onu anlayamadım. sayın enkırmenimiz ahmet hakan ankırıyor ki "bu üçünü dinler okur ve takip ederseniz işte benim gibi bir dindar olursunuz. bakın ben bunlar sayesinde dini sevdim ve mükemmel müslüman oldum.,saldırgan,,,,,,,,,,,,,,,,,,,,,,,,,,
