tweet,label,,,,,,,,,,,,,,,,,,,,,,,,,,
adam boşuna mı o kadar döviz stoklamış ... konuşacak kiiii dövizi değerlensin insan bile bile zarar eder mi... ama söyleyeyim o döviz stoklayanlara mezara para girişi yasak ister ateist ister hristiyan ister yahudi ister müslüman ol hiçbir inanışta öldükten sonra para işe yaramıyor,hiçbiri,,,,,,,,,,,,,,,,,,,,,,,,,,
bugün türkiye'de inkılap tarihi dersinde rum ermeni yahudi ve zararlı cemiyetlerden bahsedilir de bu cemiyetlerin arkasındaki mason cemiyetleri neden gizlenir? mason cemiyetleri zararlı değil idiyse atatürk neden kapattı?,hiçbiri,,,,,,,,,,,,,,,,,,,,,,,,,,
hayat o kadar berbat ki hiç doğmamak daha iyi olurdu. kim o kadar şanslı ki? yüz binde bir bile değil yahudi sözü,hiçbiri,,,,,,,,,,,,,,,,,,,,,,,,,,
dalga geçiyor resmen kadın. bu hdp'li vekiller ermeni ve yahudi. duyarsızlıkları bundan. e be kadın senin de evladın var. senin de farklı şekilde ciğerin yanar.,nefret,,,,,,,,,,,,,,,,,,,,,,,,,,
acaba filistinliler kime ihanet etti? abdülhamit'in yalnızlığı yazımız #abdulhamit #abdulhamithan #payitahtabduelhamid #israil #filistin #yahudi #theodorherzl #filistinyalanlari #israel,nefret,,,,,,,,,,,,,,,,,,,,,,,,,,
yahudi yıllarca türk milletine sabunu hacı şakir diye yutturdu... şimdi ise ekrem'i imamın çocuğu diye!,nefret,,,,,,,,,,,,,,,,,,,,,,,,,,
gazeteci metin duran serbest bırakıldı. bu konuda mardin kamu yetkililerinin yardımlarına teşekkür ediyoruz. biz eleştirilmesi gereken yerde eleştiriyoruz. arkadaşlar bana gelen vakalarda ayrım da yapmıyoruz sağcı solcu türk kürt dindar ateist benim için kesinlikle farketmiyor!,hiçbiri,,,,,,,,,,,,,,,,,,,,,,,,,,
benim anladığım 80'ler ve 90'larda çocuk olup bugün laik ateist olanların çoğu o dönem kuran kursuna gitmişken ne hikmetse o zamanın çocuğu bugünün islamcıları zulüm yüzünden gidememiş.,hiçbiri,,,,,,,,,,,,,,,,,,,,,,,,,,
her içki içen ateist sarışına "sen türke benzemiyorsun" diyen basmakalıp önyargılıların artık şu gerçekle yüzleşmesi gerekiyor onlar türk'e benzemiyor değil türkler birbirine benzemiyor. ve böylesi hepsinin birbirine benzemesinden daha iyi...,hiçbiri,,,,,,,,,,,,,,,,,,,,,,,,,,
ateist derneklerinin yerinde olsam akp yeni şafak yeni akit ve bütün pelikancılara islam'dan soğutma ve dinsizleştirme çalışmalarındaki başarılarından dolayı plaket verirdim. turan dursun bu kadar ateist yetiştiremedi. fikret orman,hiçbiri,,,,,,,,,,,,,,,,,,,,,,,,,,
ateist olsam kelime şehadet getirir müslüman olurum öyle bir güzellik,hiçbiri,,,,,,,,,,,,,,,,,,,,,,,,,,
sizin anlatacağınız islam insanı ya deist yapar ya ateist. sonra cahil insanlar sizi islam zannedip islam'dan uzaklaşıyor. ya adam gibi allah'ın ipine sarılın indirdikleriyle yönetin ya da çekin elinizi islamdan.,hiçbiri,,,,,,,,,,,,,,,,,,,,,,,,,,
geçmişteki chp'nin eğitim müfredatı yat ali yat uyu uyu yat uyu. ayşe sen de uyu dünkü chp darbelerden beslenen kaset komplosuyla gb değiştiren şimdiki chp solcu komünist ateist liboş domuz sever ezandan rahatsız olan hdppkk'ya selam gönderenlerden meydana gelmiş bir örgüt.,nefret,,,,,,,,,,,,,,,,,,,,,,,,,,
lisede ateist olduğunu iddia eden arkadaşım muhafazakar bir kızla söz kesmiş. ne diyelim hayırlı olsun,hiçbiri,,,,,,,,,,,,,,,,,,,,,,,,,,
hayır evrimi savunan bir twiti yine ateist olan bir kitleye şikayet etmenin mantığı ne...,hiçbiri,,,,,,,,,,,,,,,,,,,,,,,,,,
adam astsubay kuzey ırak'ta bomba ile vefat ediyor. ücretle çalışan bir asker islam inancı var ya da yok. yaşamında müslüman olduğuna dair bir ibare olmamış. belki de ateist. bu da şehit mi oluyor? bu şehit kavramı bence tekrar gözden geçirilmeli.,hiçbiri,,,,,,,,,,,,,,,,,,,,,,,,,,
ben bir türküm düşmanlarım beni katlederken inancıma bakmıyorlar kızılbaş sünni şaman müslüman hristiyanı ateist farketmiyor. hocalı'da karabağ'da doğu türkistan'da kerkük'te afganistan'da türkmen dağında balkanlarda öldürülen benim beni öldürüyorlar çünkü ben türk'üm,hiçbiri,,,,,,,,,,,,,,,,,,,,,,,,,,
yani çok özel ve basit örneklemek gerekirse var olan herkesin atatürkçü dinibütün ateist laik vs bir arada yaşayabileceğimizi hepimizin kanıksaması ve bu yönde çabalaması toplumsal barışın temel anahtarıdır. ya değilse ayrışma ve iç savaş tehlikesini her zaman yaşayabiliriz.,hiçbiri,,,,,,,,,,,,,,,,,,,,,,,,,,
çevremde akp'ye bakıp dinden soğuyan birçok insan var hatta ateist olanları bile duydum akp'ye bakarak dinden soğumayın kardeşim islamı kurandan öğrenin fikret orman,hiçbiri,,,,,,,,,,,,,,,,,,,,,,,,,,
ateist de olsanız gelen maillere bakıp günde bir kere allahım ne salak insanlar var diyorsunuz.,hiçbiri,,,,,,,,,,,,,,,,,,,,,,,,,,
kurandaki ayetler çelişiyor diyen bir ateist der ki canı melek mi alıyor. allah mı? cevab canı allah alıyor. ama azrail a.s da alıyor. bunu şöyle düşünebiliriz. cumhurbaşkanı onaylamadan başbakan birşey yapamaz. ve bazen cumhur başbakana bazı işleri yaptırır. bu mesele de böyle.,hiçbiri,,,,,,,,,,,,,,,,,,,,,,,,,,
elinde birayla ateist arkadaşı islama çağırma 10/11 kral hareket,hiçbiri,,,,,,,,,,,,,,,,,,,,,,,,,,
küçükken müslüman olmama rağmen ateist sanıyorlardı beni orospu çocukları saçım uzun olunca ateist olmuş olmuyorum sizin o gerici beyninizi sikerim anası sikikler,saldırgan,,,,,,,,,,,,,,,,,,,,,,,,,,
ülkenin yarısı dini doğru yaşadığını sanıyor diğer yarısı da ülkenin diğer yarısı yüzünden ateist,hiçbiri,,,,,,,,,,,,,,,,,,,,,,,,,,
allah'ına kurban dediğimiz herkes ateist çıkıyor,hiçbiri,,,,,,,,,,,,,,,,,,,,,,,,,,
ben çaldım ama ateist olduğum için değil günah olduğu için. muhtaçlara yardım etmedim sevap olduğundan hiç rüşvet almadım ama veren olmadığı için yani kötü olmam için satanist olmama gerek yok insan olmak yetiyor. lagustane laveyan sweatshirt,hiçbiri,,,,,,,,,,,,,,,,,,,,,,,,,,
sınıftakilerin benim için düşündükleri kategoriler ateist misin? uzaylı mısın? tiner mi içiyorsun? neden hep gülüyorsun? ay çok tatlısın yanaklarını sıkmak istiyorum hiçbirinin birbiri ile alakası olmaması sanırım kendimi anlamadığım gibi başkası da beni çözememiş,hiçbiri,,,,,,,,,,,,,,,,,,,,,,,,,,
2018'de konda'ya göre ateist ve inançsız toplamı %4'müş. yakında alevilerden %5 fazla dinsiz olacak,hiçbiri,,,,,,,,,,,,,,,,,,,,,,,,,,
türkiye'de gerçek ateist yok,hiçbiri,,,,,,,,,,,,,,,,,,,,,,,,,,
böyle dini yorumlar yüzünde millet ateist oluyor.,hiçbiri,,,,,,,,,,,,,,,,,,,,,,,,,,
ateist değil o gizli gizli cumaya gidiyor,hiçbiri,,,,,,,,,,,,,,,,,,,,,,,,,,
akp iktidarı 17 yılda ülkedeki bütün tarikatları devlete yerleştirerek liselerin tamamını imam hatip yaparak en çok atama ve bütçeyi de diyanet işleri başkanlığına vererek nihayetinde deist sayısını %5000 ateist sayısını %700 artırmayı başarmıştır. onlar konuşur akp yapar!...,hiçbiri,,,,,,,,,,,,,,,,,,,,,,,,,,
yanımdaki arkadaş "ben felsefe okuyorum" diyor. karşıdaki şahsın ilk söyleyeceği cümle "sen ateist misin?" ya felsefe dinle ilgilenmiyor. ilgi olanı düşüncedir. her konuya açıktır. ne güzel demiş descartes düşünüyorum öyleyse varım.,hiçbiri,,,,,,,,,,,,,,,,,,,,,,,,,,
din ile coolluk işlerini ayıramayıp hava olsun diye ateist olan gençlerimize çok üzülüyorum.,hiçbiri,,,,,,,,,,,,,,,,,,,,,,,,,,
çoğu kişi allah'ın varlığına inanmayı müslümanlık zannediyor. yani ateist değilsen müslümansın... hayır değilsin. allah'a teslim olduysan müslümansın. teslimiyet ise onun emir ve yasaklarına! #yanındayızkılıçdaroğlu,hiçbiri,,,,,,,,,,,,,,,,,,,,,,,,,,
eğitim öğretim sistemimiz gözden geçirilmeli ateist bir kuşak yetiştiren bu sistem acilen milli ve manevi değerlerimizi öğreten bir eğitim ve öğretim kadrosu ile pekiştirmelidir.,nefret,,,,,,,,,,,,,,,,,,,,,,,,,,
ya muhammed. bak ben ateist değilim. ateizmi hiç savunmadım. müslüman bir ailede doğdum. müslümanca yaşamaya çalıştım. islamı daha iyi ve daha doğru yaşamaya çalıştım. hangisi doğru diye sürekli araştırdım.,hiçbiri,,,,,,,,,,,,,,,,,,,,,,,,,,
ünlü ateist yazar profesör richard dawkins'in yapamadığını bütün okulları imam hatipe en çok atama ve bütçeyi diyanet başkanlığına vermesine rağmen 17 yıllık akp iktidarı yapmış ülkede ateist sayısı %700 artmış... onlar konuşur aq partisi yapar!,nefret,,,,,,,,,,,,,,,,,,,,,,,,,,
dinciler inançsız insan olmaz diyerek kafa bulandırırlar. evet inançsız insan olmaz. her insan ateist bile olsa bir şeylere inanır. tabi bu dinsel anlamda değil. örneğin ben evrende varlığını sürdüren en ilkel varlıklar olduğumuza inanıyorum. bizden fazla gelişmiş ırklar vardır.,hiçbiri,,,,,,,,,,,,,,,,,,,,,,,,,,
ateist olmamayı müslüman olmak zannedenler var. #sicilibozuk,hiçbiri,,,,,,,,,,,,,,,,,,,,,,,,,,
ateist ramazan sizlerle,hiçbiri,,,,,,,,,,,,,,,,,,,,,,,,,,
keşke maraş belediyesi beni de şehirden kovsa başka türlü gidemiyorum. boş yere şehrin ahlakını ve dini bütünlüğünü ateist halimle bozmayayım.,hiçbiri,,,,,,,,,,,,,,,,,,,,,,,,,,
ah be her sago dinlediğimde kendimi şarkıdan çok neden ateist olduğunu sorgulamaya veriyorum. acı kaybımız olmuş resmen.,nefret,,,,,,,,,,,,,,,,,,,,,,,,,,
siyasal ateizm antiteizm hareketimize ateist cumhuriyeti web sayfamıza gönüllü web tasarımcıları aranıyor. mür. melike myers,hiçbiri,,,,,,,,,,,,,,,,,,,,,,,,,,
sonra da insanlar niye ateist oluyormuş senin gibiler yüzünden cübbeli. cübbeli ahmet hoca tuvalet taşının allah ile konuşmasını anlatıyor. ya rabbim ne suçum vardı da beni tuvalet taşı yaptın? sus! 60 yaşını geçip de sakalsız ölene mezar taşı yaparsam daha mı iyi olur?,hiçbiri,,,,,,,,,,,,,,,,,,,,,,,,,,
bu tür heriflerin islama gram faydası yok bunları dinleyen aklı başında herkes ateist ya da hristiyan olur,hiçbiri,,,,,,,,,,,,,,,,,,,,,,,,,,
bazı hocalar keşke sussa değil ateist deist oluyor insanlar. 5g'den ses hızına yaklaşan araçlardan bahsederken uçsuz bucaksız çölde deveyle 3 gün yalnız yol mu gidiyoruz? çemberin içinde olmak öyle güzel ki keşke o meftunluğu anlatsanız da kalpler yumuşasa,hiçbiri,,,,,,,,,,,,,,,,,,,,,,,,,,
feminist ateist sosyal medya uzmanı la tahzen ile başlayan arapça birşey rte. bir taraf olmayı aşırı huy edinmiş insanlara huy oluyorum,hiçbiri,,,,,,,,,,,,,,,,,,,,,,,,,,
bazı sosyalist ateist vatandaşlara bakıyorum da hepsi akp yüzünden dinden çıkmışlar. mertçe doğruyu söyleyin akp'nin islami bir yapısının olmadığını en iyi siz biliyorsunuz. sizin derdiniz nefsinize uymak yalan söylemeyin. #cluvgs,hiçbiri,,,,,,,,,,,,,,,,,,,,,,,,,,
küçücük çocuklara böyle şiddet içerikli ideolojik ve dinsel temalı şiirleri metinleri ne hakla okutuyorsunuz? secde etmek kahpe kutsal kitabımız? hristiyan musevi ateist vatandaşı yok mu bu ülkenin?,hiçbiri,,,,,,,,,,,,,,,,,,,,,,,,,,
sonra insanlar neden deist ya da ateist oluyor,hiçbiri,,,,,,,,,,,,,,,,,,,,,,,,,,
şunun gibi 20 30 tane ateist müslüman tartışması izlemişimdir birinde de şöyle bitmiyor "bak senin körü körüne inandığını ve allah'ın olmadığını bilimle ispat ettim" aksine şöyle bitiyor ateist "inanmak istemiyorum ben kardeşim canım istemiyor.",hiçbiri,,,,,,,,,,,,,,,,,,,,,,,,,,
yeni ateist olmuşken muhafazakar sevgili yapmışımdır...,hiçbiri,,,,,,,,,,,,,,,,,,,,,,,,,,
çıldırmamak için canlı gs maçı izlemeyeceğime and içerim ateist yeminim,hiçbiri,,,,,,,,,,,,,,,,,,,,,,,,,,
israil gerçekten zavallı bir ülke... geleceği yok. israil halkı büyük ölçüde ateist. fuhuş kumar alkol ve uyuşturucu bataklığına saplanmış bir halk...,nefret,,,,,,,,,,,,,,,,,,,,,,,,,,
dört elementten biri olsaydınız ne olurdunuz. hava su toprak ateş ben ateist.,hiçbiri,,,,,,,,,,,,,,,,,,,,,,,,,,
"""bunlar kürt değil bunlar müslüman değil bunlar gavur. hdp almış oğlumu götürmüş pkk'nın eline vermiş."" allah'ın izni ile bizi bölmeye çalışan bu kalleşleri senin gibi mübarek analarımızın desteğiyle yok edeceğiz. ağzına yüreğine sağlık mübarek anam... #annelerdireniyor",nefret,,,,,,,,,,,,,,,,,,,,,,,,,,
anadolu'dan şalvarı şaltak osmanlı eğeri kaltak osmanlı ekende yok biçende yok yiyende ortak osmanlı adalardan paşa öşür isterdi köylü da veremezdi asker köye saldırdı her şeyi yağmaladı köylüler birlik oldu paşaya karşı durdu gavur imam vurdukça osmanlı kaçar oldu,hiçbiri,,,,,,,,,,,,,,,,,,,,,,,,,,
gavur izmir kurtuluşun kutlu olsun şeref duyuyoruz!...,nefret,,,,,,,,,,,,,,,,,,,,,,,,,,
norm ender'in gavur izmir dedikten sonra şehrimin atası tektir demesi gibi bir moddayım...,hiçbiri,,,,,,,,,,,,,,,,,,,,,,,,,,
#9eylülizmirinkurtuluşu izmir'e gavur diyenler kan testi yaptırmalıdır,hiçbiri,,,,,,,,,,,,,,,,,,,,,,,,,,
tr'de olsa kaldırıma motor falan çıkardı kesin gavur memlekete bak çocuklar nasıl rahat koşturuyor,hiçbiri,,,,,,,,,,,,,,,,,,,,,,,,,,
gavur kim?,hiçbiri,,,,,,,,,,,,,,,,,,,,,,,,,,
koç grubu bak seni mason locaların dahi kurtaramaz. bu ülkede seni parasız gavur topraklarına kendi topraklarına gönderecek hazır daima hazır bir nesil var. bir yerleriniz oynamasın. lakin devlet yine uyuyor gibi yapıyor! #gezifinansörükoçunutmuyoruz,nefret,,,,,,,,,,,,,,,,,,,,,,,,,,
kürt müslümana gavur eziyeti !,nefret,,,,,,,,,,,,,,,,,,,,,,,,,,
birini tanıştırırken alevilerde "yabancı değil bizden" sünnilerde "gavur değil bizden" yabancılarda "not animal one of us",nefret,,,,,,,,,,,,,,,,,,,,,,,,,,
bakınız pkk gavur bir terör örgütüdür fetö gavur bir terör örgütüdür deaş gavur bir terör örgütüdür dhkpc gavur bir terör örgütüdür asala gavur bir terör örgütüydü tüm bu gavurları besleyen devletler de emperyalist devletlerdir #annelerdireniyor,nefret,,,,,,,,,,,,,,,,,,,,,,,,,,
mardin'den gelen emine kaya hdp bizim yüreğimizi yaktı. allah da hdp'nin yüreğini yaksın! bu kürtlük davası değil amerika davası. hepsi şerefsiz! müslüman değil gavur bunlar! onların çocukları abd'de bizim çocuklarımız dağda! çocuklarımızı hdp kandil'e götürdü. kandil hdp'dir!,nefret,,,,,,,,,,,,,,,,,,,,,,,,,,
oğlumu hdp aldı bunlar müslüman değil bunlar gavur. amerikayla iş tutuyorlar. kürt falan da değiller. kendi çocuklarını göndersinler dağa. amerika'da çocukları okuyor. ciğerimizi yaktılar allah da onların ciğerini yaksın. vicdansız bunlar. kürtlerle niye uğraşıyorlar. gavur bunlar,nefret,,,,,,,,,,,,,,,,,,,,,,,,,,
kürt denince akla evladını kaçıran terör örgütü ve uzantılarına baş kaldıran yiğit hacire ana gelir pkk'nın gavur tohumları değil! bu milletin pkk'ya verecek tek bir evladı dahi yoktur! #millibekahareketi,nefret,,,,,,,,,,,,,,,,,,,,,,,,,,
gavur suratlı terörist,nefret,,,,,,,,,,,,,,,,,,,,,,,,,,
hocalar cuma günü vaazda bu adamlara gavur diyor.,hiçbiri,,,,,,,,,,,,,,,,,,,,,,,,,,
şerefsiz haysiyetsiz yalancı gavur dölleri sıra sıra dizdiğiniz araçlar fazla ise bu alacağınız araçları nerenize monte edeceksiniz yenikapı'da şov yapan imamoğlu'nun ihale ilanı araçlar deri koltuklu kol dayama ve sunroof olsun,nefret,,,,,,,,,,,,,,,,,,,,,,,,,,
aynen öyle!... pkk müslüman değil pkk gavurdur pkk müslüman kürt düşmanıdır. ama teyzeciğim siz bu tepkinizi daha önce verecektiniz.,nefret,,,,,,,,,,,,,,,,,,,,,,,,,,
anadolu'da gavur kime denir arkadaştan,hiçbiri,,,,,,,,,,,,,,,,,,,,,,,,,,
gavur memlekette de olsak yurtta da olsak çayımızdan ve çaydanlığımızdan vazgeçmeyiz mdkdmlsösplwlw,hiçbiri,,,,,,,,,,,,,,,,,,,,,,,,,,
müslümana gavur eziyeti,nefret,,,,,,,,,,,,,,,,,,,,,,,,,,
sen müslüman biz gavur haa?!,hiçbiri,,,,,,,,,,,,,,,,,,,,,,,,,,
bizim imamoğlu'nun da şu yaptığı işe bak ünlü müslümanlar gavur katolik fransız markası clio marka arabaya biniyormuşlar 100 kilometrede de 63 litre yakıyorlarmış elhamdulillah maşallah!,nefret,,,,,,,,,,,,,,,,,,,,,,,,,,
#israf #türgev ve muhammed ali'nin michigan'da olan çiftliğini "müslüman öğrencilere burs ve yurt olanağı sağlamak amacıyla!" 2.500.000 satın almıştı. sadece değil tüm ülkeyi gavur sayıyorlar ki türkiye yerine abd'deki öğrencilere yurt açıyorlar,nefret,,,,,,,,,,,,,,,,,,,,,,,,,,
müslümanlar gavur dedikleri insanların sosyal hayattaki ahlak ve insaniyetleri ile tanıştıklarında kendilerinin insanlığa ne kadar gavur kaldıklarını anlayıp şok geçirebiliyorlar.,hiçbiri,,,,,,,,,,,,,,,,,,,,,,,,,,
terör örgütü pkk "kürt" vb değil katmerli bir "gavur" örgüttür gavur ne demektir peki? anadolu ruhunda müslüman olmayana "gavur" denmez kime denir? türkiyemize vatanımıza bayrağımıza barışa ihanet edene masum insanları katleden "gavur" denir #analardireniyor,nefret,,,,,,,,,,,,,,,,,,,,,,,,,,
gavur gavurluğunu yani işini yapıyor. niye şaşırıyoruz ki...,nefret,,,,,,,,,,,,,,,,,,,,,,,,,,
stalk gavur icadıdır günah günah yapmayın annem,nefret,,,,,,,,,,,,,,,,,,,,,,,,,,
gavur direği seni,nefret,,,,,,,,,,,,,,,,,,,,,,,,,,
paralar altına çevriliyor ki türkiye'den kaçtıktan sonra uluslararası bankalara el konulmasın diye. ulan size oy verenin ağzına gavur sıçsın emi vatan hainleri.,saldırgan,,,,,,,,,,,,,,,,,,,,,,,,,,
a haber izliyoruz gavur kanalları bizi ilgilendirmez! la tahzen,nefret,,,,,,,,,,,,,,,,,,,,,,,,,,
kurban olun gavur izmir'in merhametine,hiçbiri,,,,,,,,,,,,,,,,,,,,,,,,,,
çekler gavur gibi oynuyor. böyle oynamaya devam edersek maç 10 gün devam etse yine yenemeyiz.,nefret,,,,,,,,,,,,,,,,,,,,,,,,,,
3 risale-i nur'un muhtelif yerlerinde teknolojinin nimetlerinden faydalanmaktan bahsedilir. bu o dönem için çağ ötesi bir durumdur. o dönem alimlerinin toplanıp "elektrik gavur icadıdır anadolu!ya soksak mı sokmasak mı" diye tartıştığı bir dönem.,hiçbiri,,,,,,,,,,,,,,,,,,,,,,,,,,
isveç'te devlet harcamaları için verilen kartla sadece bir çikolata aldığı için istifa eden bir bakan ve devletimizi katrilyonlarca zarar ettiren 17 yıldır iktidar akp yöneticileri gavur dediğimiz insanlarda ahlak var müslüman sandıklarımızda ahlakın a'sı bile yok!,hiçbiri,,,,,,,,,,,,,,,,,,,,,,,,,,
gavur ülkelerde yaşıyorum böyle bir şey görmedim...,nefret,,,,,,,,,,,,,,,,,,,,,,,,,,
domuz eti yiyen ekonomi devi almanya'da bu hareketi göremezsiniz! merkel tatile çıkar koruma polisinin otel masrafını cebinden öder! toplantıya gider tarifeli uçağa biner! ya bizimkiler? müslümanım der cumaya gider elin alman'ına gavur der ama çatır çatır kul hakkı yer! #yenikapı,nefret,,,,,,,,,,,,,,,,,,,,,,,,,,
allah'ım sen küçük işleri büyük büyük işleri küçük yapmaya muktedirsin bu küçük işi öyle büyüt ki tüm ülkedeki anneler ayağa kalksın bu gavur ermeni münafık güruh silinsin gitsin amin amin allahümme amin,nefret,,,,,,,,,,,,,,,,,,,,,,,,,,
insanlık ve chp zihniyeti yan yana duramaz. gavur izmir'de sevgilisi ile birlikte çocuğunu katleden anne hiç şaşırmadım. #yenikapı,nefret,,,,,,,,,,,,,,,,,,,,,,,,,,
türk çift değil gavur bunlar,nefret,,,,,,,,,,,,,,,,,,,,,,,,,,
meb "kayıt parası soruşturmaları tamamlandı ceza görevden alma çalışmaları sürüyor." açıklaması yaptı... her tarafımız soruşturma ceza... kokuşmuşluk ve de ahlaksızlık her yanı sarmış... allah'dan islam ahlakı!!!! almış toplumuz ya gavur ahlakı alsaydık?!,nefret,,,,,,,,,,,,,,,,,,,,,,,,,,
camide adam gibi oturup hocaefendiyi dinleyecek yerde! fitne fesatlık itlik için kalkıp kendi gavur ideolojik gavur idolünü hutbede anmadı deyip alçaklık itlik yapacağınıza! gidip #hdpkk'dan kaçırdıkları çocukların hesabını sorun. ama sormazsınız. çünkü şerefsiz adi #gavursunuz.,nefret,,,,,,,,,,,,,,,,,,,,,,,,,,
o kaaaa! gavur izmirliyiz!,hiçbiri,,,,,,,,,,,,,,,,,,,,,,,,,,
lamı cimi yok kaldıracaksın f-16 uçaklarını ne kadar hdp binası varsa talan edeceksin. bombaları bırakırken soyunuz kurusun gavur tohumu diye niyet edeceksiniz.,nefret,,,,,,,,,,,,,,,,,,,,,,,,,,
benim gibi ateist yapsa dinsiz gavur dersiniz bunu yapan namazında orucunda abdestinde olup cumaları kaçırmayan şahıslar. kul hakkı? o kısım öğretilirken tuvalete gitmişler. uyan ak partiye sımsıkı sarılan vatandaş uyann artık. memleketin soyulmadık yeri kalmadı! #yenikapı,nefret,,,,,,,,,,,,,,,,,,,,,,,,,,
not işin garibi yusuf hoca ilahiyat mezunu bile değil bildiğim kadarıyla... 9 eylül sahne sanatları sinema ve tv anasanat dalı. yüksek lisansı ingiltere'de yapmış. hem de elin gavur memleketinde doktora almış... iyi ki okumamışım!,nefret,,,,,,,,,,,,,,,,,,,,,,,,,,
iki ağaç diye sokağa çıkan devlet düşmanlarının ağaçtan başka her şeyi sayan gavur kuklası sözcüsü!...,nefret,,,,,,,,,,,,,,,,,,,,,,,,,,
gavur dedikleri avrupa'da 25 çocuğa 5 yıl tecavüz edildiği ortaya çıksa yer yerinden oynardı bizim müslümanlarda tık yok...,nefret,,,,,,,,,,,,,,,,,,,,,,,,,,
adamlar ne sene yapmışlar helal olsun gavur yapıyor abi!...,hiçbiri,,,,,,,,,,,,,,,,,,,,,,,,,,
şu gavur dediklerimiz kadar yemen'i savunamıyoruz üstelik yemen operasyonuna destek veriyoruz,hiçbiri,,,,,,,,,,,,,,,,,,,,,,,,,,
bir hristiyan olarak diyorum ki küreselci çetenin ele geçiremediği son kale islam. islam ülkeleri içinde de en diri liderlik edebilecek ülke türkiye lider sayın erdoğan. bunu görmek için adil olmak yeterli. peki sayın erdoğan'ı paçasından aşağı çeken "eski dostlara" ne demeli,hiçbiri,,,,,,,,,,,,,,,,,,,,,,,,,,
cdu milletvekili ve hristiyan birlik cdu/csu federal meclis grubu dış politika sözcüsü sn jürgen hardt ile görüştük.,hiçbiri,,,,,,,,,,,,,,,,,,,,,,,,,,
isa isminin ekmeğini yedi hristiyan kızların "aaa aynı jesus gibisiniz zaten" diyeni çok oldu kardeşiz diye demiyorum yakışıklıdır zaten musa çok ezildi garibanım :)))),hiçbiri,,,,,,,,,,,,,,,,,,,,,,,,,,
3 bu meselenin doğusu batısı güneyi kuzeyi değişmiyor. mesela kilisenin ve hristiyan büyüklerin uzun zaman ortadoğu ve batıda hakimiyetini biliyoruz. dini istismar ederek bir kısım yanlış bilgileri din kılıfıyla halka dayatarak yüzyıllarca baskı kurdular.,hiçbiri,,,,,,,,,,,,,,,,,,,,,,,,,,
ermeni chp liderinin pyd pkk için sözleri utanç verici açıkça ben ermeniyim islam türk düşmanıyım asker polis katilleri benim dostumdur diyor bu bir suçtur halk olarak bu ermeni yahudi hristiyan yunan rumları 15 temmuz'da sağ bırakmakla hata ettik şimdi havlamaları normaldir,nefret,,,,,,,,,,,,,,,,,,,,,,,,,,
hz. meryem ve aziz paul var #bursa'nın #iznik'i yok! #turizmstratejiplanı #kültür #turizm #belediye #ulaşım #inanç #sağlık #doğa #türsab #iznik #nicaea #tourism #reisen #hıristiyan #christian #iznikkonsili #nicaeacouncil,hiçbiri,,,,,,,,,,,,,,,,,,,,,,,,,,
dünyaca ünlü "aşura akşamı" tablosunun sahibi ressam mahmud ferşçiyan "bu eser deruni coşku anımda zuhur etti" demiş. bazı hristiyan sanatçıların isa mesih'in mazlumiyetini böyle tasvir edemediklerine hayıflanıp gıptayla andığı muhteşem tablo türkiye'de de tanınıyor.,hiçbiri,,,,,,,,,,,,,,,,,,,,,,,,,,
senin de boyaların dökülmeye başladı foyaların ortaya çıkacak kardinal fetö iyi beslemiş belli !... yeminli hristiyan şövalyeleri kimler devlet biliyor ve gereğini vakti gelince yapar nazlı ablan da seni çok özlemiş mektubunda öyle diyor.,hiçbiri,,,,,,,,,,,,,,,,,,,,,,,,,,
3 hristiyan görünce papaz yahudi görünce haham olacaktı? bu çoklu hukuk düzenine "atatürk'ün de desteğini alarak" son veren büyük türkçü ve yurtsever mahmut esat bozkurt'tur. şimdi bunları okuduktan sonra yaptığı hukuk reformunun değerini ve büyüklüğünü anlamış olmalısınız,hiçbiri,,,,,,,,,,,,,,,,,,,,,,,,,,
dünyada hiçbir hristiyan kiliseye ne gerek var demez bizdeki türk geçinen yerli hristiyanlar camiye ne gerek var diyor,nefret,,,,,,,,,,,,,,,,,,,,,,,,,,
o kabenin sahibi olan rabbim'in adına yemin ederim ki o izzetli meryem annemizin adına yemin ederim ki o isa as sevdiğini söyleyen hristiyan devlet adamı ve kabe'yi yöneten ve diğer arap liderler doğruyu bildiğiniz halde susuyor ve şeytana yardım ediyorsun,hiçbiri,,,,,,,,,,,,,,,,,,,,,,,,,,
dünyanın esenliğe ve barışa ihtiyacı var ister müslüman olsun ister hristiyan olsun perişan durumdasınız allah sizlere yardım etmek istiyor ama lanetli kavim ve avaneleri buna engel olmak istiyor var güçleriyle bana saldırıyorlar siz ise seyrediyorsunuz,hiçbiri,,,,,,,,,,,,,,,,,,,,,,,,,,
ateist miyim müslüman mı hristiyan mı ne olduğumu ben de bilmiyorum agnostik oldum galiba en son gusülümü de ne zaman aldım bilmiyorum yıllar oldu galiba,hiçbiri,,,,,,,,,,,,,,,,,,,,,,,,,,
dostum biraz mantıklı düşün. misal ben müslümanım tabiki çocuğuma islam'ı anlatacağım. bu allah'ın rahmetidir. sonuçta hristiyan bir ailede doğan çocuğun ailesi de tercihen hristiyan olup ve çocuğunu hristiyan yapıyor. bu allah'ın suçu değil ki aklını kullansın.,hiçbiri,,,,,,,,,,,,,,,,,,,,,,,,,,
her doğan çocuk islam fıtratı üzerine doğar ama ailesi ya müslüman ya hristiyan ya da yahudi yapar. ama allah akıl vermiş idrak vermiş. allah herkesi müslüman yapsaydı o zaman iyi ile kötü nasıl ayırt edilirdi? imtihanın amacı ortadan kalkmaz mıydı?,nefret,,,,,,,,,,,,,,,,,,,,,,,,,,
